{
  "decision_recommendation": {
    "primary_recommendation": "proceed_with_modifications",
    "confidence_level": 0.78,
    "implementation_priority": "high",
    "alternative_options": [
      {
        "option": "Full implementation",
        "pros_cons": {
          "advantages": ["Maximum market capture", "Complete feature set"],
          "disadvantages": ["Higher initial cost", "Longer time to market"]
        }
      },
      {
        "option": "Phased rollout",
        "pros_cons": {
          "advantages": ["Reduced risk", "Faster initial revenue", "Learning opportunities"],
          "disadvantages": ["Competitive disadvantage", "Integration complexity"]
        }
      }
    ]
  },
  "analysis_summary": {
    "market_analysis": {
      "market_opportunity": {
        "size": 500000000,
        "growth_rate": 0.18,
        "time_to_market": 180
      },
      "competitive_positioning": {
        "differentiation_factors": ["Superior user experience", "Advanced AI features", "Regulatory compliance"],
        "barriers_to_entry": ["technology", "regulatory", "brand"]
      }
    },
    "financial_projections": {
      "revenue_forecast": {
        "year_1_revenue": 25000000,
        "year_3_revenue": 85000000,
        "peak_revenue": 200000000
      },
      "cost_structure": {
        "fixed_costs": 15000000,
        "variable_costs": 8000000,
        "customer_acquisition_cost": 250
      },
      "break_even_analysis": {
        "break_even_months": 18,
        "break_even_customers": 50000
      }
    },
    "operational_impact": {
      "resource_requirements": {
        "team_size": 45,
        "technology_stack": ["Python", "FastAPI", "PostgreSQL", "Redis", "Kubernetes"]
      },
      "timeline": {
        "development_months": 12,
        "milestones": [
          {
            "description": "MVP completion",
            "month": 6
          },
          {
            "description": "Beta launch",
            "month": 9
          },
          {
            "description": "Full launch",
            "month": 12
          }
        ]
      }
    }
  },
  "risk_assessment": {
    "overall_risk_level": "medium",
    "key_risks": [
      {
        "risk_type": "market",
        "probability": "medium",
        "impact": "high",
        "description": "Competitive response from established players"
      },
      {
        "risk_type": "technical",
        "probability": "low",
        "impact": "medium",
        "description": "Integration challenges with legacy systems"
      },
      {
        "risk_type": "regulatory",
        "probability": "medium",
        "impact": "high",
        "description": "Changes in financial regulations"
      }
    ],
    "mitigation_strategies": [
      {
        "strategy": "Competitive monitoring and rapid response capability",
        "effectiveness": "high",
        "cost": "medium"
      },
      {
        "strategy": "Phased integration approach with fallback options",
        "effectiveness": "medium",
        "cost": "low"
      },
      {
        "strategy": "Regulatory compliance buffer and legal counsel retainer",
        "effectiveness": "high",
        "cost": "medium"
      }
    ]
  },
  "implementation_plan": {
    "phases": [
      {
        "phase_name": "Foundation",
        "duration_months": 3,
        "key_deliverables": ["Core platform", "Basic features", "Security framework"]
      },
      {
        "phase_name": "Expansion",
        "duration_months": 6,
        "key_deliverables": ["Advanced features", "Market expansion", "Partnership development"]
      },
      {
        "phase_name": "Optimization",
        "duration_months": 3,
        "key_deliverables": ["Performance optimization", "Cost reduction", "Process automation"]
      }
    ],
    "success_metrics": [
      {
        "metric": "Customer acquisition",
        "target": "50,000 users",
        "timeline": "12 months"
      },
      {
        "metric": "Revenue growth",
        "target": "300% YoY",
        "timeline": "18 months"
      },
      {
        "metric": "Market share",
        "target": "5%",
        "timeline": "24 months"
      }
    ]
  },
  "metadata": {
    "run_id": "RUN-20241201-143052-a1b2c3d4",
    "span_id": "RUN-20241201-143052-a1b2c3d4-0006-DEC",
    "timestamp": "2024-12-01T14:36:08Z",
    "python_version": "3.12.10",
    "python_env_hash": "3b5f4d62df23dedd64bb27db73bd291798b5944ef4cfd2bb1fb6d469e3387b9f",
    "content_hash": "39cd26237173cdfd5c6f5c687f5bd6b9bcc28b7b0ccb2e19d875cefe4b9ad15a",
    "composite_hash": "8d5815b55e5028af951bd86972bde02a7bfc9966d1c4ab889bb9e9b9d6ba3ec6",
    "data_zone": "AMBER",
    "retention_days": 365
  }
}
